{"schema_version":"bridge.v1","source":"gemini-strategy","generated_at":"2026-09-03T04:00:19Z","tasks":[{"task_id":"boutimar-content-dmc-accredit","property_id":"boutimar.com","assigned_agent":"agent2_writer","action_type":"content_brief","target_urls":["https://boutimar.com/dmc/"],"priority":"P1","rationale":"Provide extractable entity statements regarding B2B licensing, partner onboarding workflows, and ground handling credentials so AI search engines and tour operators can cite specific institutional credentials.","payload":{"primary_keyword":"Iran DMC B2B tour operator partner","target_url_path":"/dmc/","angle":"Institutional authority and B2B ground-handling reliability for foreign tour operators.","must_cover":["Explicit B2B licensing and white-label handling capabilities for international tour operators","Structured summary of multi-destination logistics across Iran and neighboring corridors","Clear partnership onboarding workflow with direct contact points for agency contracting"]},"provenance":{"sources":["https://boutimar.com/dmc/"],"gsc_backed":false,"live_retrieval":false},"review":"required"},{"task_id":"cruise24ir-content-farsi-cruise-faq","property_id":"cruise24.ir","assigned_agent":"agent2_writer","action_type":"content_brief","target_urls":["https://cruise24.ir/"],"priority":"P1","rationale":"Close the Farsi AI-recall gap by embedding factual, clear semantic explanations distinguishing easy-visa Persian Gulf and Dubai routes from true no-visa routes.","payload":{"primary_keyword":"رزرو تور کشتی کروز خلیج فارس","target_url_path":"/","angle":"Transparent visa guidelines and route navigation for Persian Gulf and regional cruise seekers.","must_cover":["Clear distinction between easy-visa Persian Gulf and Dubai itineraries versus AROYA no-visa routes","Step-by-step booking and documentation guide in Farsi for regional cruise departures","Direct comparison of onboard amenities and port stops for Persian Gulf itineraries"]},"provenance":{"sources":["https://cruise24.ir/"],"gsc_backed":false,"live_retrieval":false},"review":"required"},{"task_id":"exploreorient-content-silkroad-entity","property_id":"exploreorient.com","assigned_agent":"agent2_writer","action_type":"content_brief","target_urls":["https://exploreorient.com/"],"priority":"P2","rationale":"Establish independent European-facing Silk Road entity positioning with extractable cultural itinerary statements, maintaining strict brand separation from Middle East regional DMC structures.","payload":{"primary_keyword":"Silk Road multi-country cultural tours Europe","target_url_path":"/","angle":"Boutique European-operated cultural heritage expedition itineraries across Central Asia and the Silk Road.","must_cover":["Distinct European tour operator framing for overland cultural expeditions","Structured multi-country itinerary highlights across Central Asian heritage stops","Clear logistical guarantees and boutique handling standards for European travelers"]},"provenance":{"sources":["https://exploreorient.com/"],"gsc_backed":false,"live_retrieval":false},"review":"required"},{"task_id":"boutimar-content-mice-infrastructure","property_id":"boutimar.com","assigned_agent":"agent2_writer","action_type":"content_brief","target_urls":["https://boutimar.com/mice/"],"priority":"P1","rationale":"Provide extractable B2B corporate event infrastructure details to capture 2027 forward-planning queries from international corporate delegations and trade exhibition planners.","payload":{"primary_keyword":"Iran MICE ground handler trade exhibition logistics","target_url_path":"/mice/","angle":"Comprehensive trade show coordination, delegation management, and corporate hospitality for Tehran and Kish exhibitions.","must_cover":["End-to-end delegation and exhibition booth handling services for major Tehran trade fairs","Corporate accommodation allotments and VIP logistics for international business visitors","Clear B2B inquiry pathways for 2027 exhibition calendar pre-planning"]},"provenance":{"sources":["https://boutimar.com/mice/"],"gsc_backed":false,"live_retrieval":false},"review":"required"}]}
