{"schema_version":"bridge.v1","source":"gemini-strategy","generated_at":"2026-09-03T01:30:12Z","tasks":[{"task_id":"cruise24ir-schema-farsi-faq","property_id":"cruise24.ir","assigned_agent":"agent2_writer","action_type":"schema_injection","target_urls":["https://cruise24.ir/"],"priority":"P1","rationale":"Inject FAQPage schema covering Farsi cruise buying questions to close the zero-schema gap, clarifying easy-visa rules for Persian Gulf routes.","payload":{"schema_type":"FAQPage"},"provenance":{"sources":["https://cruise24.ir/"],"gsc_backed":false,"live_retrieval":false},"review":"required"},{"task_id":"exploreorient-schema-touristtrip","property_id":"exploreorient.com","assigned_agent":"agent2_writer","action_type":"schema_injection","target_urls":["https://exploreorient.com/tour/"],"priority":"P2","rationale":"Deploy TouristTrip JSON-LD to structured European-facing cultural itineraries, closing the zero-schema gap while maintaining corporate separation from Iran identities.","payload":{"schema_type":"TouristTrip"},"provenance":{"sources":["https://exploreorient.com/tour/"],"gsc_backed":false,"live_retrieval":false},"review":"required"},{"task_id":"boutimar-content-b2b-experience","property_id":"boutimar.com","assigned_agent":"agent2_writer","action_type":"content_brief","target_urls":["https://boutimar.com/experience/"],"priority":"P1","rationale":"Embed extractable B2B institutional statements into /experience/.","payload":{"primary_keyword":"B2B Iran Tour Operator partner onboarding","target_url_path":"/experience/"},"provenance":{"sources":["https://boutimar.com/experience/"],"gsc_backed":false,"live_retrieval":false},"review":"required"}]}
