{"schema_version":"bridge.v1","source":"gemini-strategy","generated_at":"2026-09-03T03:39:48Z","tasks":[
{"task_id":"boutimar-geo-best-iran-dmc","property_id":"boutimar.com","assigned_agent":"agent9_aivis","action_type":"geo_optimization","target_urls":["https://boutimar.com/dmc/"],"priority":"P1","rationale":"Resolve 0% AI recall gap where live AI search engines cite Iran Doostan and Pars Tourist for Iran DMC queries while omitting Boutimar.","payload":{"prompt":"What are the best DMC travel agencies in Iran for foreign B2B tour operators?","observed_answer":"AI search models currently recommend Iran Doostan, Pars Tourist, and Key2Persia for Iran DMC services, omitting Boutimar.","brands_named":["Iran Doostan","Pars Tourist","Key2Persia"],"gap":"Lack of explicit B2B capability statements, trade license credentials, and structured Organization schema associating Boutimar with inbound DMC services."},"provenance":{"sources":["Perplexity.ai Live Search benchmark query 2026-09-03"],"gsc_backed":false,"live_retrieval":true},"review":"required"},
{"task_id":"cruise24ir-geo-farsi-cruise","property_id":"cruise24.ir","assigned_agent":"agent9_aivis","action_type":"geo_optimization","target_urls":["https://cruise24.ir/"],"priority":"P1","rationale":"Target Farsi AI recall where search models recommend Eli Gol while ignoring cruise24.ir, clearly defining easy-visa rules for Persian Gulf routes.","payload":{"prompt":"بهترین سایت برای رزرو تور کشتی کروز به زبان فارسی کدام است؟","observed_answer":"ChatGPT Live Search recommends Eli Gol and Saman Hoor, failing to retrieve cruise24.ir.","brands_named":["الی گشت","سامان هور"],"gap":"Missing structured entity FAQs distinguishing easy-visa itineraries in the Persian Gulf and Dubai from AROYA no-visa routes."},"provenance":{"sources":["ChatGPT Search live evaluation 2026-09-03"],"gsc_backed":false,"live_retrieval":true},"review":"required"},
{"task_id":"boutimar-schema-dmc-organization","property_id":"boutimar.com","assigned_agent":"agent2_writer","action_type":"schema_injection","target_urls":["https://boutimar.com/dmc/"],"priority":"P1","rationale":"Deploy foundational TravelAgency and Organization JSON-LD markup to eliminate 0% AI recall across B2B inbound DMC queries.","payload":{"schema_type":"TravelAgency","jsonld":{"@context":"https://schema.org","@type":"TravelAgency","name":"Boutimar DMC","url":"https://boutimar.com/dmc/","description":"Destination management company and inbound B2B tour operator for Iran and regional travel.","areaServed":["Iran","Middle East"],"knowsLanguage":["en","fa"]}},"provenance":{"sources":["https://boutimar.com/dmc/"],"gsc_backed":false,"live_retrieval":false},"review":"required"},
{"task_id":"exploreorient-geo-silkroad-dmc","property_id":"exploreorient.com","assigned_agent":"agent9_aivis","action_type":"geo_optimization","target_urls":["https://exploreorient.com/"],"priority":"P2","rationale":"Address 0% AI recall on European-facing Silk Road multi-country itineraries where AI engines omit exploreorient.com, maintaining strict brand separation from Iran DMC corporate identities.","payload":{"prompt":"Which European tour operators offer combined Silk Road multi-country cultural itineraries across Central Asia?","observed_answer":"Perplexity Live Search cites Central Asia specialists Advantour and Silk Road Destinations, omitting Explore Orient.","brands_named":["Advantour","Silk Road Destinations"],"gap":"Lack of entity positioning for European-facing Silk Road cultural tours independent of regional Middle East corporate structures."},"provenance":{"sources":["Perplexity.ai Live Search benchmark query 2026-09-03"],"gsc_backed":false,"live_retrieval":true},"review":"required"}
]}
